"variable","lmg_pct","ci_lower","ci_upper","description"
"q3",17.1665282854612,9.27316846780131,26.5209387382276,"Leadership Skills (Guiding teams)"
"q2",16.0675828752614,9.76148397566278,23.7589662831925,"Communication Skills (Writing, Presentation)"
"q6",15.7292452269887,10.1528436614773,22.9079992360241,"Network Quality (Insights/Advice)"
"q1",14.3878799544225,6.78371033770206,29.1620730813899,"Technical Skills (Programming, Data Analysis)"
"q4",13.3942736156782,8.50382185101831,20.784616021371,"Time Management (Organization, Deadlines)"
"q7",12.6719655106612,7.4426402457972,20.0818927691846,"Network Access (Professional circles)"
"q5",10.5825245315268,6.96913955616641,15.0740241070305,"Network Size (Quantity of connections)"
